{
  "courseId": "fundamentos-scout",
  "title": "Fundamentos del Movimiento Scout",
  "subtitle": "Ruta Servir en el Grupo · Nivel 1",
  "description": "Curso completo sobre los fundamentos esenciales del Movimiento Scout: historia, misión, método scout y su impacto global. Base de la ruta para servir en el Grupo, apoyando a las otras ramas.",
  "contentVersion": "2026-09-27",
  "registration": { "motivationLabel": "¿Por qué quieres servir en otra rama de tu Grupo?" },
  "icon": "🏕️",
  "duration": "2 horas",
  "totalContentModules": 6,
  "modules": [
    {
      "id": 1,
      "title": "Bienvenido/a",
      "emoji": "🏠",
      "navLabel": "Inicio",
      "isIntro": true,
      "sections": [
        {
          "type": "info-box",
          "text": "<strong>¡Siempre Listo/a para Servir!</strong><br>Estás a punto de embarcarte en un viaje educativo que te preparará para transmitir el legado scout a las nuevas generaciones."
        },
        {
          "type": "heading",
          "level": 3,
          "text": "🎯 Objetivos del Curso"
        },
        {
          "type": "list",
          "ordered": false,
          "items": [
            "<strong>Conocer la misión y propósito</strong> del movimiento scout mundial",
            "<strong>Comprender los orígenes históricos</strong> del movimiento scout",
            "<strong>Dominar las características esenciales</strong> del escultismo",
            "<strong>Entender los 8 elementos</strong> del método scout correctamente",
            "<strong>Fortalecer conceptos educativos</strong> scouts aplicables a niños y niñas",
            "<strong>Prepararte para servir en tu Grupo</strong>, apoyando a las otras ramas"
          ]
        }
      ]
    },
    {
      "id": 2,
      "title": "Misión y Propósito del Movimiento Scout",
      "emoji": "🎯",
      "navLabel": "Misión",
      "sections": [
        {
          "type": "mission-box",
          "text": "<h3>🌟 MISIÓN DEL MOVIMIENTO SCOUT</h3><blockquote style=\"font-size: 1.1rem; font-style: italic; text-align: center; margin: 20px 0; color: #1a4b6b;\">\"Contribuir a la educación de los jóvenes, mediante un sistema de valores basado en la Promesa y la Ley Scout, para ayudar a construir un mundo mejor donde las personas se sientan realizadas como individuos y asumen un papel constructivo en la sociedad.\"</blockquote>"
        },
        {
          "type": "heading",
          "level": 3,
          "text": "¿Cómo logramos esta misión?"
        },
        {
          "type": "paragraph",
          "text": "A través de un sistema de valores basado en la <strong>Promesa y la Ley Scout</strong>, que ayuda a los jóvenes a construir un proyecto de vida basado en el servicio a los demás."
        },
        {
          "type": "heading",
          "level": 3,
          "text": "🎯 Nuestro Propósito Fundamental"
        },
        {
          "type": "list",
          "ordered": true,
          "items": [
            "<strong>Desarrollo del carácter:</strong> Formar personas íntegras con valores sólidos",
            "<strong>Entrenamiento para la ciudadanía:</strong> Preparar ciudadanos activos y responsables",
            "<strong>Desarrollo físico y mental:</strong> Promover la salud integral",
            "<strong>Servicio a los demás:</strong> Fomentar el compromiso social"
          ]
        },
        {
          "type": "heading",
          "level": 3,
          "text": "📜 La Promesa Scout"
        },
        {
          "type": "info-box",
          "text": "<em>\"Prometo por mi honor hacer todo cuanto de mí dependa para cumplir mis deberes para con Dios y la Patria, ayudar al prójimo en toda circunstancia y cumplir fielmente la Ley Scout.\"</em>"
        },
        {
          "type": "heading",
          "level": 3,
          "text": "⚖️ La Ley Scout"
        },
        {
          "type": "list",
          "ordered": true,
          "items": [
            "El Scout cifra su honor en ser digno de confianza",
            "El Scout es leal",
            "El Scout es útil y ayuda a los demás",
            "El Scout es amigo de todos y hermano de cualquier Scout",
            "El Scout es cortés",
            "El Scout ama la naturaleza y protege a los animales y plantas",
            "El Scout obedece sin replicar y hace las cosas en orden y completas",
            "El Scout sonríe y canta en sus dificultades",
            "El Scout es económico, trabajador y cuidadoso del bien ajeno",
            "El Scout es limpio y sano en pensamientos, palabras y obras"
          ]
        }
      ],
      "reflection": {
        "prompt": "¿Cómo aplicarías estos valores al trabajar con los niños, niñas y jóvenes de la rama donde vas a servir?"
      },
      "quiz": {
        "title": "Evaluación - Misión y Propósito",
        "questions": [
          {
            "text": "¿Cuál es el objetivo principal de la misión scout?",
            "options": [
              "Enseñar técnicas de campamento y supervivencia al aire libre",
              "Contribuir a la educación para construir un mundo mejor",
              "Formar exploradores profesionales"
            ],
            "correctIndex": 1
          },
          {
            "text": "¿En qué se basa el sistema de valores scout?",
            "options": [
              "En reglamentos militares",
              "En la Promesa y la Ley Scout",
              "En técnicas de supervivencia"
            ],
            "correctIndex": 1
          }
        ],
        "nextLabel": "Continuar a Mafeking ⛰️"
      }
    },
    {
      "id": 3,
      "title": "Mafeking - El Origen del Movimiento Scout",
      "emoji": "⛰️",
      "navLabel": "Mafeking",
      "sections": [
        {
          "type": "heading",
          "level": 3,
          "text": "📅 El Sitio de Mafeking (1899-1900)"
        },
        {
          "type": "paragraph",
          "text": "Durante la Guerra de los Bóers en Sudáfrica, el coronel Robert Baden-Powell defendió la ciudad de Mafeking durante 217 días. Esta experiencia cambiaría la historia de la educación juvenil para siempre."
        },
        {
          "type": "timeline",
          "items": [
            {
              "title": "🏰 El Desafío",
              "description": "Baden-Powell tenía solo 1,000 hombres para defender la ciudad contra 8,000 atacantes. Necesitaba toda la ayuda posible."
            },
            {
              "title": "👦 Los Jóvenes Cadetes",
              "description": "Organizó a los jóvenes de la ciudad en el \"Cuerpo de Cadetes de Mafeking\". Les asignó tareas importantes: mensajeros, primeros auxilios, centinelas, cocineros."
            },
            {
              "title": "💡 La Revelación",
              "description": "Baden-Powell descubrió que los jóvenes, cuando se les da responsabilidad y confianza, son capaces de mucho más de lo que los adultos imaginan."
            },
            {
              "title": "✨ La Semilla del Escultismo",
              "description": "Esta experiencia le mostró que los jóvenes responden positivamente cuando:",
              "subitems": [
                "Se les confían responsabilidades reales",
                "Trabajan en pequeños grupos",
                "Tienen un propósito claro",
                "El servicio a otros les genera satisfacción"
              ]
            }
          ]
        },
        {
          "type": "heading",
          "level": 3,
          "text": "🎖️ El Héroe Nacional"
        },
        {
          "type": "paragraph",
          "text": "Al regresar a Inglaterra, Baden-Powell era un héroe nacional. Su libro \"Aids to Scouting\" (Ayudas para el Escultismo), escrito para militares, estaba siendo usado por maestros y organizaciones juveniles."
        },
        {
          "type": "info-box",
          "text": "<strong>💭 Dato Curioso:</strong> Los jóvenes de Mafeking usaban bicicletas para entregar mensajes, convirtiéndose en los primeros \"scouts\" no oficiales. Su lema era \"¡Siempre Listos!\" - que permanece hasta hoy."
        }
      ],
      "reflection": {
        "prompt": "¿Qué lecciones de Mafeking aplicarías al trabajar con niños y jóvenes? ¿Cómo les darías responsabilidades apropiadas?"
      },
      "quiz": {
        "title": "Evaluación - Mafeking",
        "questions": [
          {
            "text": "¿Qué descubrió Baden-Powell sobre los jóvenes en Mafeking?",
            "options": [
              "Que necesitan que un adulto les indique constantemente qué hacer",
              "Que son capaces de mucho más cuando se les da responsabilidad",
              "Que solo sirven para tareas simples"
            ],
            "correctIndex": 1
          },
          {
            "text": "¿Cuál fue el papel de los jóvenes en Mafeking?",
            "options": [
              "Mensajeros, primeros auxilios, centinelas y apoyo logístico",
              "Solo observadores",
              "Combatientes armados en la línea de defensa de la ciudad"
            ],
            "correctIndex": 0
          }
        ],
        "nextLabel": "Continuar a Brownsea 🏝️"
      }
    },
    {
      "id": 4,
      "title": "Brownsea Island - El Primer Campamento Scout",
      "emoji": "🏝️",
      "navLabel": "Brownsea",
      "sections": [
        {
          "type": "heading",
          "level": 3,
          "text": "📅 1-9 de Agosto de 1907"
        },
        {
          "type": "paragraph",
          "text": "Años después de Mafeking, Baden-Powell decidió poner a prueba sus ideas educativas. Organizó el primer campamento scout en la Isla de Brownsea, en el Canal de la Mancha."
        },
        {
          "type": "info-box",
          "text": "<strong>🏕️ El Campamento Experimental</strong><br>• 20 jóvenes de diferentes clases sociales<br>• 9 días de actividades<br>• 4 patrullas: Cuervos, Lobos, Toros y Chorlitos<br>• Cada patrulla con su propio líder juvenil"
        },
        {
          "type": "heading",
          "level": 3,